{
  "schemaVersion": "1.0.0",
  "benchmark": "Frappe Inspector public Community benchmark v1",
  "benchmarkDate": "2026-07-30",
  "methodology": "methodology.md",
  "scope": "Isolated standalone scans of ten public Frappe applications. Frappe and external dependency schemas were not included.",
  "caveats": [
    "Community mode was used without a Pro license.",
    "JSON and SARIF exports and migration diff were unavailable in this run.",
    "Exit code 1 indicates that the findings threshold was met; completed report generation is recorded as scan success.",
    "Reviewed classifications apply only to the 30 sampled findings, not to every raw finding."
  ],
  "totals": {
    "projects": 10,
    "success": 10,
    "failure": 0,
    "errors": 2374,
    "warnings": 1044,
    "rawFindings": 3418,
    "durationMs": 22021,
    "reviewed": 30,
    "likelyActionable": 2,
    "needsMaintainerContext": 9,
    "falsePositive": 19,
    "deterministic": 10
  },
  "projects": [
    {
      "project": "ERPNext",
      "slug": "erpnext",
      "repository": "https://github.com/frappe/erpnext.git",
      "branch": "develop",
      "commit": "d59c5e36bcb53be84ec46bd5d29b5c0b2f46f929",
      "commitDate": "2026-07-30T23:24:59+05:30",
      "benchmarkDate": "2026-07-30",
      "cli": {
        "package": "@frappe-inspector/cli",
        "version": "1.2.3",
        "license": "community"
      },
      "environment": {
        "nodeVersion": "v22.11.0",
        "npmVersion": "11.4.2"
      },
      "command": "frappe-inspector scan <project-path> --format markdown --output <artifact-directory>/report.md",
      "status": "success",
      "scan": {
        "exitCode": 1,
        "completed": true,
        "startedAt": "2026-07-30T23:26:24.4502447Z",
        "endedAt": "2026-07-30T23:26:37.6368651Z",
        "durationMs": 13180,
        "errors": 962,
        "warnings": 430,
        "rawFindings": 1392,
        "riskyMigrations": 0,
        "needsReview": 0,
        "stderrEmpty": true,
        "reportSha256": "8fd2ecb762d48e10d820147250d0803f8dd0f8e7f0ea2a5d5932491521d215af"
      },
      "deterministic": true,
      "reviewed": {
        "total": 3,
        "likelyActionable": 1,
        "needsMaintainerContext": 0,
        "falsePositive": 2,
        "findings": [
          {
            "classification": "likely-actionable",
            "rule": "FI002",
            "finding": "POS Profile.utm_medium points to UTM Campaign.",
            "location": "erpnext/accounts/doctype/pos_profile/pos_profile.json:417",
            "evidence": "The neighboring utm_campaign and utm_source fields target UTM Campaign and UTM Source, while other ERPNext utm_medium fields target UTM Medium. The source at lines 417-420 instead targets UTM Campaign."
          },
          {
            "classification": "false-positive",
            "rule": "FI031",
            "finding": "Patch target erpnext.patches.v12_0.update_is_cancelled_field could not be resolved.",
            "location": "erpnext/patches.txt:2",
            "evidence": "The target module exists at erpnext/patches/v12_0/update_is_cancelled_field.py in the scanned commit."
          },
          {
            "classification": "false-positive",
            "rule": "FI031",
            "finding": "Patch target erpnext.patches.v11_0.rename_production_order_to_work_order could not be resolved.",
            "location": "erpnext/patches.txt:3",
            "evidence": "The target module exists at erpnext/patches/v11_0/rename_production_order_to_work_order.py in the scanned commit."
          }
        ]
      },
      "artifacts": {
        "projectPage": "projects/erpnext.md",
        "report": "reports/erpnext/report.md",
        "checksum": "reports/erpnext/report.sha256",
        "metadata": "reports/erpnext/metadata.json",
        "screenshot": "screenshots/erpnext.webp"
      }
    },
    {
      "project": "HRMS",
      "slug": "hrms",
      "repository": "https://github.com/frappe/hrms.git",
      "branch": "develop",
      "commit": "fd430b654630becd4ae5298089450c9b2abd3753",
      "commitDate": "2026-07-30T15:02:03+05:30",
      "benchmarkDate": "2026-07-30",
      "cli": {
        "package": "@frappe-inspector/cli",
        "version": "1.2.3",
        "license": "community"
      },
      "environment": {
        "nodeVersion": "v22.11.0",
        "npmVersion": "11.4.2"
      },
      "command": "frappe-inspector scan <project-path> --format markdown --output <artifact-directory>/report.md",
      "status": "success",
      "scan": {
        "exitCode": 1,
        "completed": true,
        "startedAt": "2026-07-30T23:26:51.9481195Z",
        "endedAt": "2026-07-30T23:26:54.6389957Z",
        "durationMs": 2690,
        "errors": 581,
        "warnings": 338,
        "rawFindings": 919,
        "riskyMigrations": 0,
        "needsReview": 0,
        "stderrEmpty": true,
        "reportSha256": "5ab2c20e291380b58c8d49654e8014ed67acf475c8569213a825d2f6cef6e171"
      },
      "deterministic": true,
      "reviewed": {
        "total": 3,
        "likelyActionable": 0,
        "needsMaintainerContext": 1,
        "falsePositive": 2,
        "findings": [
          {
            "classification": "needs-maintainer-context",
            "rule": "FI002",
            "finding": "Appraisal.employee points to unknown DocType Employee.",
            "location": "hrms/hr/doctype/appraisal/appraisal.json:58",
            "evidence": "hrms/hooks.py declares required_apps = [\"frappe/erpnext\"]. Employee belongs to the omitted dependency schema, so the isolated app scan cannot decide the installed-bench result."
          },
          {
            "classification": "false-positive",
            "rule": "FI031",
            "finding": "Patch target hrms.patches.v15_0.check_version_compatibility_with_frappe could not be resolved.",
            "location": "hrms/patches.txt:2",
            "evidence": "The module exists at hrms/patches/v15_0/check_version_compatibility_with_frappe.py."
          },
          {
            "classification": "false-positive",
            "rule": "FI031",
            "finding": "Patch target hrms.patches.v16_0.merge_interview_round_with_interview_type could not be resolved.",
            "location": "hrms/patches.txt:3",
            "evidence": "The module exists at hrms/patches/v16_0/merge_interview_round_with_interview_type.py."
          }
        ]
      },
      "artifacts": {
        "projectPage": "projects/hrms.md",
        "report": "reports/hrms/report.md",
        "checksum": "reports/hrms/report.sha256",
        "metadata": "reports/hrms/metadata.json",
        "screenshot": "screenshots/hrms.webp"
      }
    },
    {
      "project": "Payments",
      "slug": "payments",
      "repository": "https://github.com/frappe/payments.git",
      "branch": "develop",
      "commit": "aa3516827fe51d5557975b74e574e3bca9a3070d",
      "commitDate": "2026-06-15T10:44:53+05:30",
      "benchmarkDate": "2026-07-30",
      "cli": {
        "package": "@frappe-inspector/cli",
        "version": "1.2.3",
        "license": "community"
      },
      "environment": {
        "nodeVersion": "v22.11.0",
        "npmVersion": "11.4.2"
      },
      "command": "frappe-inspector scan <project-path> --format markdown --output <artifact-directory>/report.md",
      "status": "success",
      "scan": {
        "exitCode": 1,
        "completed": true,
        "startedAt": "2026-07-30T23:26:58.7965007Z",
        "endedAt": "2026-07-30T23:26:59.3812804Z",
        "durationMs": 584,
        "errors": 47,
        "warnings": 5,
        "rawFindings": 52,
        "riskyMigrations": 0,
        "needsReview": 0,
        "stderrEmpty": true,
        "reportSha256": "79499332b8df6c8eff9f8703d7a36940799adcb15803e0556ef4c7f1b86cd563"
      },
      "deterministic": true,
      "reviewed": {
        "total": 3,
        "likelyActionable": 0,
        "needsMaintainerContext": 2,
        "falsePositive": 1,
        "findings": [
          {
            "classification": "needs-maintainer-context",
            "rule": "FI010",
            "finding": "Unknown DocType Web Form.",
            "location": "payments/overrides/payment_webform.py:68",
            "evidence": "Web Form is supplied by Frappe, whose schema was not included in this standalone app scan."
          },
          {
            "classification": "needs-maintainer-context",
            "rule": "FI010",
            "finding": "Unknown DocType Payment Request.",
            "location": "payments/payment_gateways/doctype/braintree_settings/braintree_settings.py:281",
            "evidence": "The source intentionally loads Payment Request in a gateway integration; the standalone scan omitted the external app schema that supplies that DocType."
          },
          {
            "classification": "false-positive",
            "rule": "FI030",
            "finding": "Hook before_install target payments.utils.before_install could not be resolved.",
            "location": "payments/hooks.py:66",
            "evidence": "payments/utils/__init__.py re-exports before_install from payments/utils/utils.py, where the function is defined."
          }
        ]
      },
      "artifacts": {
        "projectPage": "projects/payments.md",
        "report": "reports/payments/report.md",
        "checksum": "reports/payments/report.sha256",
        "metadata": "reports/payments/metadata.json",
        "screenshot": "screenshots/payments.webp"
      }
    },
    {
      "project": "Lending",
      "slug": "lending",
      "repository": "https://github.com/frappe/lending.git",
      "branch": "develop",
      "commit": "ee9269ba08b72fd22295a993986d6502ce1bc399",
      "commitDate": "2026-07-29T10:47:12+05:30",
      "benchmarkDate": "2026-07-30",
      "cli": {
        "package": "@frappe-inspector/cli",
        "version": "1.2.3",
        "license": "community"
      },
      "environment": {
        "nodeVersion": "v22.11.0",